{
  "title": "{{name}} documentation",
  "tagline": "The reference guide to {{name}}: every screen, every setting and how they really work, explained element by element.",
  "spaces": ["use", "product", "admin", "develop"],
  "sections": [
    {
      "id": "use",
      "title": "Using {{name}}",
      "shortTitle": "Use",
      "icon": "screen",
      "subtitle": "The user's daily work: every screen, element by element, and what it really does.",
      "space": "use",
      "highlights": ["Signing in and finding your way", "Every screen explained item by item", "The pitfalls to know"],
      "groups": [
        {
          "title": "Getting started",
          "pages": [
            {
              "id": "use/getting-started",
              "title": "Getting started",
              "menuTitle": "Getting started",
              "summary": "Sign in, find your way around the interface and reach any screen.",
              "template": "screen",
              "routes": ["/"]
            }
          ]
        }
      ]
    },
    {
      "id": "features",
      "title": "Features of {{name}}",
      "shortTitle": "Features",
      "icon": "book",
      "subtitle": "What each feature does, for whom, and the rules it enforces — no code.",
      "space": "product",
      "highlights": [
        "One sheet per feature, with its access rule",
        "The business rules, in one place",
        "Who can do what"
      ],
      "groups": [
        {
          "title": "Features",
          "pages": [
            {
              "id": "features/example-feature",
              "title": "An example feature (sample to replace)",
              "menuTitle": "Example feature",
              "summary": "Model of a feature sheet: rename it after the first feature of {{name}}, and keep its F-01 id or renumber it.",
              "template": "feature",
              "feature": "F-01",
              "counterpart": "take-over/architecture/example-feature"
            }
          ]
        }
      ]
    },
    {
      "id": "configure",
      "title": "Configure — the editors",
      "shortTitle": "Configure",
      "icon": "sliders",
      "featured": true,
      "subtitle": "Every editor and every setting, with the real mechanism it drives.",
      "space": "admin",
      "highlights": ["The mechanism behind each setting", "The complete settings reference", "End-to-end recipes"],
      "groups": [
        {
          "title": "Editors",
          "pages": [
            {
              "id": "configure/sample-editor",
              "title": "An editor (sample to replace)",
              "menuTitle": "Sample editor",
              "summary": "Model of an editor page: rename it after the first editor of the application.",
              "template": "editor"
            }
          ]
        }
      ]
    },
    {
      "id": "administer",
      "title": "Administer the platform",
      "shortTitle": "Administer",
      "icon": "shield",
      "subtitle": "Access, reference data and system settings.",
      "space": "admin",
      "highlights": ["Accounts and permissions", "Reference data", "System settings"],
      "groups": [
        {
          "title": "Access",
          "pages": [
            {
              "id": "administer/users",
              "title": "Users",
              "menuTitle": "Users",
              "summary": "The register of accounts: who has access, with which role, and how to handle someone who leaves.",
              "template": "screen"
            }
          ]
        }
      ]
    },
    {
      "id": "operate",
      "space": "admin",
      "title": "Operate the application",
      "shortTitle": "Operate",
      "groups": [
        {
          "title": "Architecture",
          "pages": [
            {
              "id": "take-over/technical-architecture",
              "title": "Technical architecture document",
              "menuTitle": "Production setup",
              "summary": "The production setup: what runs and where, the numbered flows, what remains to be confirmed and who manages what.",
              "template": "architecture"
            }
          ]
        },
        {
          "title": "Takeover dossier",
          "pages": [
            {
              "id": "take-over/access-ownership",
              "title": "Access and ownership",
              "menuTitle": "Access and ownership",
              "summary": "Who owns what, where the secrets live, and the checklist to actually receive them.",
              "template": "access-ownership"
            },
            {
              "id": "take-over/runbook",
              "title": "Runbook",
              "menuTitle": "Runbook",
              "summary": "Install, build, deploy, roll back, back up: the exact commands, read from the real pipeline.",
              "template": "runbook"
            }
          ]
        }
      ]
    },
    {
      "id": "take-over",
      "title": "Take the project over",
      "shortTitle": "Take over",
      "icon": "code",
      "subtitle": "What you need to know to run and evolve the application: architecture, production setup, troubleshooting, findings.",
      "space": "develop",
      "highlights": [
        "The architecture and the production setup",
        "Troubleshooting by symptom",
        "The numbered findings"
      ],
      "groups": [
        {
          "title": "Architecture",
          "pages": [
            {
              "id": "take-over/architecture",
              "title": "Architecture overview",
              "menuTitle": "Architecture",
              "summary": "The big picture, the technical stack, the principles and the main flows.",
              "template": "technical"
            },
            {
              "id": "take-over/architecture/example-feature",
              "title": "The example feature, technically",
              "menuTitle": "Example feature",
              "summary": "The technical counterpart of the example feature sheet: how it is actually implemented.",
              "level": 2,
              "template": "technical-sub",
              "counterpart": "features/example-feature"
            }
          ]
        },
        {
          "title": "Operate and evolve",
          "pages": [
            {
              "id": "take-over/troubleshooting",
              "title": "Troubleshooting by symptom",
              "menuTitle": "Troubleshooting",
              "summary": "From the symptom to the likely cause, the check and the fix.",
              "template": "troubleshooting"
            },
            {
              "id": "take-over/troubleshooting/access",
              "title": "Troubleshooting: access, permissions and visibility",
              "menuTitle": "Access and permissions",
              "summary": "Sign-in refused, empty menu, missing screen or button, invisible data.",
              "level": 2,
              "template": "troubleshooting-area"
            },
            {
              "id": "take-over/findings",
              "title": "Findings at takeover",
              "menuTitle": "Findings",
              "summary": "The gaps, risks and debts found, re-checked in the code, numbered and ranked by severity: the risk register.",
              "template": "findings"
            },
            {
              "id": "take-over/maintaining-docs",
              "title": "Maintaining this documentation",
              "menuTitle": "Maintaining the docs",
              "summary": "How the site is built and checked, how to write a page, and how to hand the folder over.",
              "template": "technical"
            }
          ]
        },
        {
          "title": "Takeover dossier",
          "pages": [
            {
              "id": "take-over/agent-instructions",
              "title": "Agent instruction files",
              "menuTitle": "Agent instructions",
              "summary": "Every AI agent instruction file found in the code, rule by rule, checked against what it actually does.",
              "template": "agent-instructions"
            }
          ]
        }
      ]
    }
  ],
  "journeys": [
    {
      "title": "I use {{name}} every day",
      "description": "Sign in, find your way, then every screen of the daily work.",
      "space": "use",
      "steps": ["use/getting-started"]
    },
    {
      "title": "I specify a feature",
      "description": "What a feature does, for whom, its rules, its behaviours and its acceptance criteria.",
      "space": "product",
      "steps": ["features/example-feature"]
    },
    {
      "title": "I administer {{name}}",
      "description": "The settings and their mechanism, the accounts, then the production setup and the runbook.",
      "space": "admin",
      "steps": ["configure/sample-editor", "administer/users", "take-over/technical-architecture", "take-over/runbook"]
    },
    {
      "title": "I take the project over",
      "description": "What you need to know to run and evolve the application, in five pages.",
      "space": "develop",
      "steps": [
        "take-over/architecture",
        "take-over/technical-architecture",
        "take-over/findings",
        "take-over/troubleshooting",
        "take-over/maintaining-docs"
      ]
    }
  ],
  "suggestions": [
    "use/getting-started",
    "features/example-feature",
    "take-over/architecture",
    "take-over/troubleshooting"
  ]
}
