{
  "title": "Documentation d'Acme Orders",
  "tagline": "La documentation de démonstration du kit : quatre espaces (Utiliser, Produit, Administrer, Développer), des fiches de fonctionnalité et des règles de gestion, un registre des risques, une sous-page, deux écrans annotés, un schéma, un glossaire et un parcours de lecture.",
  "spaces": ["use", "product", "admin", "develop"],
  "sections": [
    {
      "id": "use",
      "space": "use",
      "title": "Utiliser Acme Orders",
      "shortTitle": "Utiliser",
      "icon": "screen",
      "subtitle": "Le travail de tous les jours : la liste des commandes et les réglages du profil.",
      "highlights": ["La liste des commandes, annotée", "Les réglages, pas à pas"],
      "groups": [
        {
          "title": "Prise en main",
          "pages": [
            {
              "id": "use/orders",
              "title": "La liste des commandes",
              "menuTitle": "Commandes",
              "summary": "Les filtres, le résumé d'une commande et le bouton Nouvelle commande.",
              "template": "screen",
              "routes": ["/orders"],
              "permissions": ["orders:read"]
            },
            {
              "id": "use/orders/detail",
              "title": "Le détail d'une commande",
              "menuTitle": "Détail",
              "level": 2,
              "summary": "Ce qui change une fois la commande créée."
            },
            {
              "id": "use/settings",
              "title": "Les réglages du profil",
              "menuTitle": "Réglages",
              "summary": "Modifier son profil et l'enregistrer.",
              "routes": ["/settings"],
              "permissions": ["settings:write"]
            }
          ]
        }
      ]
    },
    {
      "id": "features",
      "space": "product",
      "title": "Les fonctionnalités d'Acme Orders",
      "shortTitle": "Fonctionnalités",
      "icon": "book",
      "subtitle": "Ce que fait chaque fonctionnalité, pour qui, et selon quelle règle.",
      "highlights": ["L'approbation d'une commande, de bout en bout", "Qui peut faire quoi"],
      "groups": [
        {
          "title": "Trouver une commande",
          "epic": "E-01",
          "summary": "Voir toutes les commandes et où chacune en est.",
          "pages": [
            {
              "id": "features/track-orders",
              "title": "Suivre les commandes",
              "menuTitle": "Suivre les commandes",
              "summary": "Filtrer la liste des commandes et ouvrir une commande pour voir son statut.",
              "template": "feature",
              "feature": "F-01",
              "since": "1.0",
              "permissions": ["orders:read"]
            }
          ]
        },
        {
          "title": "Approuver une commande",
          "epic": "E-02",
          "summary": "Les grosses commandes attendent un responsable avant de partir.",
          "pages": [
            {
              "id": "features/approve-order",
              "title": "Approuver une commande",
              "menuTitle": "Approuver une commande",
              "summary": "Ouvrir la chaîne d'approbation d'une commande pour que les approbateurs soient prévenus.",
              "template": "feature",
              "feature": "F-02",
              "since": "1.2",
              "permissions": ["orders:read", "orders:approve"],
              "counterpart": "secure/api-surface~the-routes"
            }
          ]
        },
        {
          "title": "Règles et rôles",
          "pages": [
            {
              "id": "features/rules",
              "title": "Règles de gestion",
              "menuTitle": "Règles de gestion",
              "summary": "Les règles communes à plusieurs fonctionnalités, définies une fois et citées partout.",
              "template": "business-rules"
            },
            {
              "id": "features/roles",
              "title": "Rôles et droits",
              "menuTitle": "Rôles et droits",
              "summary": "Les rôles livrés avec Acme Orders, et qui peut faire quoi.",
              "template": "roles-matrix"
            }
          ]
        }
      ]
    },
    {
      "id": "operate",
      "space": "admin",
      "title": "Exploiter l'application",
      "shortTitle": "Exploiter",
      "groups": [
        {
          "title": "Propriété et API",
          "pages": [
            {
              "id": "secure/access-ownership",
              "title": "Accès et propriété",
              "menuTitle": "Accès et propriété",
              "summary": "À qui appartiennent le dépôt, l'hébergement et le secret de session.",
              "template": "access-ownership"
            }
          ]
        }
      ]
    },
    {
      "id": "maintain",
      "space": "develop",
      "title": "Maintenir Acme Orders",
      "shortTitle": "Maintenir",
      "icon": "code",
      "featured": true,
      "subtitle": "Pour l'équipe qui reprend le projet : l'architecture et le circuit des données.",
      "highlights": ["Une architecture en trois blocs"],
      "groups": [
        {
          "title": "Technique",
          "pages": [
            {
              "id": "maintain/architecture",
              "title": "L'architecture d'Acme Orders",
              "menuTitle": "Architecture",
              "summary": "Les trois blocs d'Acme Orders et la façon dont ils communiquent."
            }
          ]
        }
      ]
    },
    {
      "id": "secure",
      "space": "develop",
      "title": "Sécuriser Acme Orders",
      "shortTitle": "Sécuriser",
      "icon": "shield",
      "subtitle": "Qui possède quoi, la surface de l'API et ses failles.",
      "highlights": ["Aucun contrôle de rôle aujourd'hui"],
      "groups": [
        {
          "title": "Propriété et API",
          "pages": [
            {
              "id": "secure/api-surface",
              "title": "La surface de l'API",
              "menuTitle": "Surface de l'API",
              "summary": "Chaque route, qui peut l'appeler, et les failles.",
              "template": "api-surface",
              "counterpart": "features/approve-order"
            }
          ]
        }
      ]
    },
    {
      "id": "risks",
      "space": "develop",
      "title": "Les risques d'Acme Orders",
      "shortTitle": "Risques",
      "icon": "warning",
      "subtitle": "Les constats, revérifiés dans le code.",
      "highlights": ["Aucun contrôle d'accès aujourd'hui"],
      "groups": [
        {
          "title": "Constats",
          "pages": [
            {
              "id": "risks/findings",
              "title": "Constats",
              "menuTitle": "Constats",
              "summary": "Trois constats, revérifiés dans le code : un critique, un important, un mineur.",
              "template": "findings"
            }
          ]
        }
      ]
    }
  ],
  "journeys": [
    {
      "title": "Découvrir Acme Orders",
      "description": "Les trois pages à lire en premier.",
      "steps": ["use/orders", "use/settings", "maintain/architecture"]
    }
  ],
  "suggestions": [
    "use/orders",
    "features/track-orders",
    "features/approve-order",
    "secure/api-surface",
    "risks/findings",
    "maintain/architecture"
  ]
}
