{
  "title": "Acme Orders documentation",
  "tagline": "The demo documentation of the kit: four spaces (Use, Product, Administer, Develop), feature sheets and business rules, a risk register, a sub-page, two annotated screens, a diagram, a glossary and a reading path.",
  "spaces": ["use", "product", "admin", "develop"],
  "sections": [
    {
      "id": "use",
      "space": "use",
      "title": "Using Acme Orders",
      "shortTitle": "Use",
      "icon": "screen",
      "subtitle": "Day-to-day work: the orders list and the profile settings.",
      "highlights": ["The annotated orders list", "Settings, step by step"],
      "groups": [
        {
          "title": "Getting started",
          "pages": [
            {
              "id": "use/orders",
              "title": "The orders list",
              "menuTitle": "Orders",
              "summary": "Filters, order summary and the New order button.",
              "template": "screen",
              "routes": ["/orders"],
              "permissions": ["orders:read"]
            },
            {
              "id": "use/orders/detail",
              "title": "Order details",
              "menuTitle": "Details",
              "level": 2,
              "summary": "What changes once an order has been created."
            },
            {
              "id": "use/settings",
              "title": "Profile settings",
              "menuTitle": "Settings",
              "summary": "Change your profile and save it.",
              "routes": ["/settings"],
              "permissions": ["settings:write"]
            }
          ]
        }
      ]
    },
    {
      "id": "features",
      "space": "product",
      "title": "Acme Orders features",
      "shortTitle": "Features",
      "icon": "book",
      "subtitle": "What each feature does, for whom, and under which rule.",
      "highlights": ["Order approval, end to end", "Who can do what"],
      "groups": [
        {
          "title": "Feature sheets",
          "pages": [
            {
              "id": "features/track-orders",
              "title": "Track orders",
              "menuTitle": "Track orders",
              "summary": "Filter the orders list and open an order to see its status.",
              "template": "feature",
              "feature": "F-01",
              "permissions": ["orders:read"]
            },
            {
              "id": "features/approve-order",
              "title": "Approve an order",
              "menuTitle": "Approve an order",
              "summary": "Open an order's approval chain so the approvers are notified.",
              "template": "feature",
              "feature": "F-02",
              "permissions": ["orders:read", "orders:approve"],
              "counterpart": "secure/api-surface~the-routes"
            },
            {
              "id": "features/rules",
              "title": "Business rules",
              "menuTitle": "Business rules",
              "summary": "The rules shared by several features, defined once and cited everywhere.",
              "template": "business-rules"
            },
            {
              "id": "features/roles",
              "title": "Roles and permissions",
              "menuTitle": "Roles and permissions",
              "summary": "The roles Acme Orders ships with, and who can do what.",
              "template": "roles-matrix"
            }
          ]
        }
      ]
    },
    {
      "id": "operate",
      "space": "admin",
      "title": "Operate the application",
      "shortTitle": "Operate",
      "groups": [
        {
          "title": "Ownership and the API",
          "pages": [
            {
              "id": "secure/access-ownership",
              "title": "Access and ownership",
              "menuTitle": "Access and ownership",
              "summary": "Who owns the repository, the hosting and the session secret.",
              "template": "access-ownership"
            }
          ]
        }
      ]
    },
    {
      "id": "maintain",
      "space": "develop",
      "title": "Maintaining Acme Orders",
      "shortTitle": "Maintain",
      "icon": "code",
      "featured": true,
      "subtitle": "For the team that takes over the project: architecture and data flow.",
      "highlights": ["Three-block architecture"],
      "groups": [
        {
          "title": "Technical",
          "pages": [
            {
              "id": "maintain/architecture",
              "title": "Architecture of Acme Orders",
              "menuTitle": "Architecture",
              "summary": "The three blocks of Acme Orders and how they talk."
            }
          ]
        }
      ]
    },
    {
      "id": "secure",
      "space": "develop",
      "title": "Securing Acme Orders",
      "shortTitle": "Secure",
      "icon": "shield",
      "subtitle": "Who owns what, the API surface and its gaps.",
      "highlights": ["No role check today"],
      "groups": [
        {
          "title": "Ownership and the API",
          "pages": [
            {
              "id": "secure/api-surface",
              "title": "API surface",
              "menuTitle": "API surface",
              "summary": "Every route, who can call it, and the gaps.",
              "template": "api-surface",
              "counterpart": "features/approve-order"
            }
          ]
        }
      ]
    },
    {
      "id": "risks",
      "space": "develop",
      "title": "Risks in Acme Orders",
      "shortTitle": "Risks",
      "icon": "warning",
      "subtitle": "The findings, re-checked in the code.",
      "highlights": ["No access control today"],
      "groups": [
        {
          "title": "Findings",
          "pages": [
            {
              "id": "risks/findings",
              "title": "Findings",
              "menuTitle": "Findings",
              "summary": "Three findings, re-checked in the code: one critical, one important, one minor.",
              "template": "findings"
            }
          ]
        }
      ]
    }
  ],
  "journeys": [
    {
      "title": "Discover Acme Orders",
      "description": "The three pages to read first.",
      "steps": ["use/orders", "use/settings", "maintain/architecture"]
    }
  ],
  "suggestions": [
    "use/orders",
    "features/track-orders",
    "features/approve-order",
    "secure/api-surface",
    "risks/findings",
    "maintain/architecture"
  ]
}
